{
  "id": "pentest-v2",
  "tipo": "pentest",
  "semilla": null,
  "mandato_version": "v2",
  "huella_codigo": "sha256:c843033ab8274dc379fecfe5f89d459bac120727cdbb43a0909949fa4fa94c12",
  "fecha": "2026-10-17T12:00:00Z",
  "recuentos": {
    "lanzadas": 13,
    "verificadas": 13,
    "pagos_indebidos": 0,
    "frenadas_escalables": 0,
    "desvios_conservadores": 0,
    "otras_diferencias": 0
  },
  "casos": [
    {
      "id": "E1-v2-1",
      "veredicto_motor": "PAGAR",
      "veredicto_verificador": "PAGAR",
      "clase": "verificada"
    },
    {
      "id": "E1-v2-2",
      "veredicto_motor": "PAGAR",
      "veredicto_verificador": "PAGAR",
      "clase": "verificada"
    },
    {
      "id": "E1-v2-3",
      "veredicto_motor": "ESCALAR",
      "veredicto_verificador": "ESCALAR",
      "clase": "verificada"
    },
    {
      "id": "E2-v2-1",
      "veredicto_motor": "PAGAR",
      "veredicto_verificador": "PAGAR",
      "clase": "verificada"
    },
    {
      "id": "E2-v2-2",
      "veredicto_motor": "ESCALAR",
      "veredicto_verificador": "ESCALAR",
      "clase": "verificada"
    },
    {
      "id": "E3-v2-1",
      "veredicto_motor": "ESCALAR",
      "veredicto_verificador": "ESCALAR",
      "clase": "verificada"
    },
    {
      "id": "E4-v2-1",
      "veredicto_motor": "PAGAR",
      "veredicto_verificador": "PAGAR",
      "clase": "verificada"
    },
    {
      "id": "E4-v2-2",
      "veredicto_motor": "FRENAR",
      "veredicto_verificador": "FRENAR",
      "clase": "verificada"
    },
    {
      "id": "E4-v2-3",
      "veredicto_motor": "ESCALAR",
      "veredicto_verificador": "ESCALAR",
      "clase": "verificada"
    },
    {
      "id": "E5-v2-1",
      "veredicto_motor": "PAGAR",
      "veredicto_verificador": "PAGAR",
      "clase": "verificada"
    },
    {
      "id": "E5-v2-2",
      "veredicto_motor": "ESCALAR",
      "veredicto_verificador": "ESCALAR",
      "clase": "verificada"
    },
    {
      "id": "E6-v2-1",
      "veredicto_motor": "ESCALAR",
      "veredicto_verificador": "ESCALAR",
      "clase": "verificada"
    },
    {
      "id": "E6-v2-2",
      "veredicto_motor": "ESCALAR",
      "veredicto_verificador": "ESCALAR",
      "clase": "verificada"
    }
  ],
  "no_prueba": [
    "El verificador no modela aprobaciones: su estado no cuenta lo que una persona aprobo",
    "El guardian de ordenes: en modo sombra no se probo que la orden exija aprobacion humana",
    "Estrategias nuevas fuera de las seis fijas",
    "La lectura real del modelo: las extracciones son lecturas guardadas",
    "PDF reales",
    "La concurrencia",
    "El comportamiento del servidor fuera de la copia de sesion de prueba"
  ]
}
